{
  "schemaVersion": "1.0",
  "packageId": "swk-ma-g4-mathematics-u05-l02",
  "lessonRef": {
    "lessonId": "ma-g4-mathematics-u05-l02",
    "courseId": "ma-g4-mathematics",
    "grade": 4,
    "unitNumber": 5,
    "phase": "Concept build A"
  },
  "answers": [
    {
      "ref": "ma-g4-mathematics-u05-l02#gp-01",
      "itemType": "division-with-remainder",
      "standard": "4.NBT.6",
      "difficulty": 1,
      "answerType": "fixed",
      "answer": "43 r2",
      "answerIndex": 3,
      "given": {
        "divisor": 3,
        "quotient": 43,
        "remainder": 2
      },
      "solutionReasoning": {
        "steps": [
          "3 × 43 = 129.",
          "131 − 129 = 2, and 2 is less than 3.",
          "So 131 ÷ 3 = 43 remainder 2."
        ],
        "answer": "43 r2"
      },
      "referenceExample": {
        "prompt": "Find 53 ÷ 6.",
        "steps": [
          "6 × 8 = 48.",
          "53 − 48 = 5, and 5 is less than 6.",
          "53 ÷ 6 = 8 remainder 5."
        ],
        "answer": "8 r5"
      },
      "verification": {
        "method": "recomputed",
        "oracle": "curriculum-production/student-work/mathematics-g34/src/g34/grade4Unit5.ts#division-with-remainder.oracle",
        "parameters": {
          "divisor": 3,
          "quotient": 43,
          "remainder": 2
        }
      },
      "commonErrors": [
        {
          "observed": "Answered 43 r3 instead of 43 r2.",
          "likelyCause": "Used the divisor itself as the remainder instead of subtracting to find what is left over.",
          "remediation": "Remind the learner the remainder must always be smaller than the divisor — check by subtracting."
        }
      ]
    },
    {
      "ref": "ma-g4-mathematics-u05-l02#gp-02",
      "itemType": "division-with-remainder",
      "standard": "4.NBT.6",
      "difficulty": 1,
      "answerType": "fixed",
      "answer": "26 r3",
      "answerIndex": 2,
      "given": {
        "divisor": 6,
        "quotient": 26,
        "remainder": 3
      },
      "solutionReasoning": {
        "steps": [
          "6 × 26 = 156.",
          "159 − 156 = 3, and 3 is less than 6.",
          "So 159 ÷ 6 = 26 remainder 3."
        ],
        "answer": "26 r3"
      },
      "referenceExample": {
        "prompt": "Find 53 ÷ 6.",
        "steps": [
          "6 × 8 = 48.",
          "53 − 48 = 5, and 5 is less than 6.",
          "53 ÷ 6 = 8 remainder 5."
        ],
        "answer": "8 r5"
      },
      "verification": {
        "method": "recomputed",
        "oracle": "curriculum-production/student-work/mathematics-g34/src/g34/grade4Unit5.ts#division-with-remainder.oracle",
        "parameters": {
          "divisor": 6,
          "quotient": 26,
          "remainder": 3
        }
      },
      "commonErrors": [
        {
          "observed": "Answered 26 r6 instead of 26 r3.",
          "likelyCause": "Used the divisor itself as the remainder instead of subtracting to find what is left over.",
          "remediation": "Remind the learner the remainder must always be smaller than the divisor — check by subtracting."
        }
      ]
    },
    {
      "ref": "ma-g4-mathematics-u05-l02#gp-03",
      "itemType": "division-with-remainder",
      "standard": "4.NBT.6",
      "difficulty": 2,
      "answerType": "fixed",
      "answer": "70 r5",
      "answerIndex": 0,
      "given": {
        "divisor": 6,
        "quotient": 70,
        "remainder": 5
      },
      "solutionReasoning": {
        "steps": [
          "6 × 70 = 420.",
          "425 − 420 = 5, and 5 is less than 6.",
          "So 425 ÷ 6 = 70 remainder 5."
        ],
        "answer": "70 r5"
      },
      "referenceExample": {
        "prompt": "Find 53 ÷ 6.",
        "steps": [
          "6 × 8 = 48.",
          "53 − 48 = 5, and 5 is less than 6.",
          "53 ÷ 6 = 8 remainder 5."
        ],
        "answer": "8 r5"
      },
      "verification": {
        "method": "recomputed",
        "oracle": "curriculum-production/student-work/mathematics-g34/src/g34/grade4Unit5.ts#division-with-remainder.oracle",
        "parameters": {
          "divisor": 6,
          "quotient": 70,
          "remainder": 5
        }
      },
      "commonErrors": [
        {
          "observed": "Answered 70 r6 instead of 70 r5.",
          "likelyCause": "Used the divisor itself as the remainder instead of subtracting to find what is left over.",
          "remediation": "Remind the learner the remainder must always be smaller than the divisor — check by subtracting."
        }
      ]
    },
    {
      "ref": "ma-g4-mathematics-u05-l02#ip-01",
      "itemType": "division-with-remainder",
      "standard": "4.NBT.6",
      "difficulty": 1,
      "answerType": "fixed",
      "answer": "77 r3",
      "answerIndex": 0,
      "given": {
        "divisor": 5,
        "quotient": 77,
        "remainder": 3
      },
      "solutionReasoning": {
        "steps": [
          "5 × 77 = 385.",
          "388 − 385 = 3, and 3 is less than 5.",
          "So 388 ÷ 5 = 77 remainder 3."
        ],
        "answer": "77 r3"
      },
      "referenceExample": {
        "prompt": "Find 53 ÷ 6.",
        "steps": [
          "6 × 8 = 48.",
          "53 − 48 = 5, and 5 is less than 6.",
          "53 ÷ 6 = 8 remainder 5."
        ],
        "answer": "8 r5"
      },
      "verification": {
        "method": "recomputed",
        "oracle": "curriculum-production/student-work/mathematics-g34/src/g34/grade4Unit5.ts#division-with-remainder.oracle",
        "parameters": {
          "divisor": 5,
          "quotient": 77,
          "remainder": 3
        }
      },
      "commonErrors": [
        {
          "observed": "Answered 77 r5 instead of 77 r3.",
          "likelyCause": "Used the divisor itself as the remainder instead of subtracting to find what is left over.",
          "remediation": "Remind the learner the remainder must always be smaller than the divisor — check by subtracting."
        }
      ]
    },
    {
      "ref": "ma-g4-mathematics-u05-l02#ip-02",
      "itemType": "division-with-remainder",
      "standard": "4.NBT.6",
      "difficulty": 2,
      "answerType": "fixed",
      "answer": "67 r3",
      "answerIndex": 2,
      "given": {
        "divisor": 4,
        "quotient": 67,
        "remainder": 3
      },
      "solutionReasoning": {
        "steps": [
          "4 × 67 = 268.",
          "271 − 268 = 3, and 3 is less than 4.",
          "So 271 ÷ 4 = 67 remainder 3."
        ],
        "answer": "67 r3"
      },
      "referenceExample": {
        "prompt": "Find 53 ÷ 6.",
        "steps": [
          "6 × 8 = 48.",
          "53 − 48 = 5, and 5 is less than 6.",
          "53 ÷ 6 = 8 remainder 5."
        ],
        "answer": "8 r5"
      },
      "verification": {
        "method": "recomputed",
        "oracle": "curriculum-production/student-work/mathematics-g34/src/g34/grade4Unit5.ts#division-with-remainder.oracle",
        "parameters": {
          "divisor": 4,
          "quotient": 67,
          "remainder": 3
        }
      },
      "commonErrors": [
        {
          "observed": "Answered 67 r4 instead of 67 r3.",
          "likelyCause": "Used the divisor itself as the remainder instead of subtracting to find what is left over.",
          "remediation": "Remind the learner the remainder must always be smaller than the divisor — check by subtracting."
        }
      ]
    },
    {
      "ref": "ma-g4-mathematics-u05-l02#ip-03",
      "itemType": "division-with-remainder",
      "standard": "4.NBT.6",
      "difficulty": 2,
      "answerType": "fixed",
      "answer": "81 r3",
      "answerIndex": 2,
      "given": {
        "divisor": 6,
        "quotient": 81,
        "remainder": 3
      },
      "solutionReasoning": {
        "steps": [
          "6 × 81 = 486.",
          "489 − 486 = 3, and 3 is less than 6.",
          "So 489 ÷ 6 = 81 remainder 3."
        ],
        "answer": "81 r3"
      },
      "referenceExample": {
        "prompt": "Find 53 ÷ 6.",
        "steps": [
          "6 × 8 = 48.",
          "53 − 48 = 5, and 5 is less than 6.",
          "53 ÷ 6 = 8 remainder 5."
        ],
        "answer": "8 r5"
      },
      "verification": {
        "method": "recomputed",
        "oracle": "curriculum-production/student-work/mathematics-g34/src/g34/grade4Unit5.ts#division-with-remainder.oracle",
        "parameters": {
          "divisor": 6,
          "quotient": 81,
          "remainder": 3
        }
      },
      "commonErrors": [
        {
          "observed": "Answered 81 r6 instead of 81 r3.",
          "likelyCause": "Used the divisor itself as the remainder instead of subtracting to find what is left over.",
          "remediation": "Remind the learner the remainder must always be smaller than the divisor — check by subtracting."
        }
      ]
    },
    {
      "ref": "ma-g4-mathematics-u05-l02#mc-01",
      "itemType": "division-with-remainder",
      "standard": "4.NBT.6",
      "difficulty": 1,
      "answerType": "fixed",
      "answer": "83 r2",
      "answerIndex": 0,
      "given": {
        "divisor": 6,
        "quotient": 83,
        "remainder": 2
      },
      "solutionReasoning": {
        "steps": [
          "6 × 83 = 498.",
          "500 − 498 = 2, and 2 is less than 6.",
          "So 500 ÷ 6 = 83 remainder 2."
        ],
        "answer": "83 r2"
      },
      "referenceExample": {
        "prompt": "Find 53 ÷ 6.",
        "steps": [
          "6 × 8 = 48.",
          "53 − 48 = 5, and 5 is less than 6.",
          "53 ÷ 6 = 8 remainder 5."
        ],
        "answer": "8 r5"
      },
      "verification": {
        "method": "recomputed",
        "oracle": "curriculum-production/student-work/mathematics-g34/src/g34/grade4Unit5.ts#division-with-remainder.oracle",
        "parameters": {
          "divisor": 6,
          "quotient": 83,
          "remainder": 2
        }
      },
      "commonErrors": [
        {